[
  {
    "concept_id": "pos_mushroom_herbarium_01",
    "product_class": "poster",
    "batch_role": "style_led_set",
    "set_family": {
      "family_id": "fam_herbarium_fungi",
      "member_index": 1,
      "member_count": 3
    },
    "demand": {
      "query": "vintage mushroom print set",
      "cluster": "botanical_herbarium_fungi",
      "adjacent": [
        "antique mycology plate",
        "fungi wall art set of 3",
        "cottagecore mushroom decor",
        "woodland kitchen print",
        "amanita muscaria illustration",
        "forest foraging art",
        "sage green botanical print",
        "neutral gallery wall set",
        "herbarium specimen print",
        "moody farmhouse kitchen art",
        "printable mushroom art",
        "boho nature print set"
      ],
      "evidence": "keyword_tool",
      "evidence_note": "Botanical & nature prints ~40k/mo on Etsy; fungi sub-cluster verified via autocomplete depth",
      "est_monthly_volume": 40000,
      "competition": "medium",
      "competing_results_est": 2400,
      "niche_id": "nb_botanical"
    },
    "angle": {
      "audience": "home decorators furnishing a neutral kitchen or bathroom who already own one botanical print and want a matching set",
      "insider_vocab": [
        "herbarium",
        "latin binomial",
        "plate number",
        "specimen"
      ],
      "emotional_job": "room_decor",
      "specificity_rung": 3
    },
    "visual": {
      "style_id": "ps_botanical_plate",
      "palette_id": "pal_herbarium",
      "palette": [
        "#F3EEE2",
        "#6B7A4F",
        "#8C6A47",
        "#A8433C",
        "#3B3B33"
      ],
      "subject": "a single fly agaric specimen with cap, stipe and a small inset spore-print detail",
      "subject_lemma": "mushroom",
      "composition": "single centred specimen floating on aged cream paper, stipe cut cleanly, small inset detail lower right, wide margins on all four sides",
      "typography": "copperplate italic for the latin binomial and plate number, bottom-centre, nothing else",
      "texture": "aged paper with light foxing and a faint plate impression line",
      "avoid": [
        "modern flat vector",
        "neon colour",
        "photographic rendering",
        "decorative frame",
        "busy background"
      ],
      "reads_at_250px_via": "the specimen silhouette against flat cream",
      "render_prompt": "antique botanical plate illustration, single centred fly agaric specimen on aged cream paper, fine engraved linework with muted watercolour wash, handwritten latin binomial and plate number, subtle foxing, herbarium aesthetic, palette Herbarium strictly limited to #F3EEE2 #6B7A4F #8C6A47 #A8433C #3B3B33"
    },
    "production": {
      "target_platforms": [
        "etsy",
        "redbubble"
      ],
      "aspect_ratio": "2:3",
      "px": [
        4000,
        6000
      ],
      "dpi": 300,
      "colour_mode": "sRGB",
      "format": "PNG",
      "background": "opaque",
      "edge_buffer_px": 200,
      "ratio_exports": [
        "2:3",
        "3:4",
        "4:5",
        "11:14",
        "1:1.414"
      ]
    },
    "metadata": {
      "etsy": {
        "title": "Vintage Mushroom Print Set of 3, Sage Green Botanical Herbarium Wall Art, Kitchen Decor, Digital Download",
        "tags": [
          "fungi art print",
          "mycology poster",
          "woodland decor",
          "cottagecore kitchen",
          "forest foraging art",
          "neutral gallery wall",
          "antique plate print",
          "muted earth tones",
          "farmhouse wall art",
          "printable art set",
          "amanita illustration",
          "moody botanical art",
          "boho nature print"
        ],
        "description": "Three hand-finished specimen studies drawn in the manner of a nineteenth-century field herbarium, each on softly aged paper with its Latin name and plate number lettered by hand. Sized for a gallery wall above a kitchen counter or a bathroom shelf, and warm enough to sit beside oak, brass and linen. Files arrive in five ratio families so you can print to whatever frame you already own.",
        "attributes": {
          "colour": "green",
          "orientation": "portrait",
          "style": "vintage",
          "room": "kitchen"
        }
      },
      "redbubble": {
        "title": "Sage Green Vintage Mushroom Herbarium Print",
        "tags": [
          "vintage botanical mushroom wall art",
          "antique mycology plate illustration",
          "cottagecore mushroom foraging print",
          "woodland fungi art print",
          "muted earth tone kitchen decor",
          "neutral gallery wall print set",
          "amanita muscaria illustration",
          "herbarium specimen study",
          "farmhouse kitchen wall decor",
          "dark academia botanical art",
          "forest foraging aesthetic",
          "moody vintage nature print",
          "boho neutral home decor",
          "scientific plate illustration",
          "sage green wall art set"
        ],
        "description": "A field-guide specimen study for people who like their walls a little bit scholarly. Muted greens and rust on aged paper, hand-lettered Latin name, and enough negative space to hang beside two more without the wall shouting. Works above a kitchen counter, a reading chair, or a very small mushroom-related obsession."
      }
    },
    "ip": {
      "tier": "R0",
      "notes": "Original illustration in a public-domain genre. No named source work reproduced."
    },
    "dedup": {
      "hard_key": "ps_botanical_plate|pal_herbarium|mushroom"
    }
  },
  {
    "concept_id": "pos_red_moon_torii_01",
    "product_class": "poster",
    "batch_role": "evergreen",
    "demand": {
      "query": "minimalist japanese wall art",
      "cluster": "japan_minimal_zen",
      "adjacent": [
        "red moon japanese print",
        "zen minimalist poster",
        "japandi wall art",
        "black and white japanese art",
        "torii gate print",
        "minimalist mountain print",
        "red and black wall art",
        "japanese metal poster",
        "high contrast minimal print",
        "asian minimalist decor"
      ],
      "evidence": "bestseller_page",
      "evidence_note": "Two original Japan-aesthetic designs charted in Displate's 2025 top 25 against an otherwise licensed field",
      "est_monthly_volume": null,
      "competition": "medium",
      "niche_id": "nb_japan_asia"
    },
    "angle": {
      "audience": "collectors buying a premium metal print for a bedroom or study who want one graphic statement piece rather than a gallery wall",
      "insider_vocab": [
        "torii",
        "bokashi",
        "negative space",
        "notan"
      ],
      "emotional_job": "room_decor",
      "specificity_rung": 3
    },
    "visual": {
      "style_id": "ps_minimal_zen",
      "palette_id": "pal_red_moon",
      "palette": [
        "#0D0D0D",
        "#F5F1E8",
        "#C1272D"
      ],
      "subject": "a torii gate silhouette standing in still water beneath one enormous flat red disc",
      "subject_lemma": "torii",
      "composition": "one large flat circle occupying the upper third, torii reduced to pure silhouette on the lower horizon, vast empty cream field between them, nothing else in the frame",
      "typography": "none",
      "texture": "flat, with a single subtle paper grain and no gradient anywhere",
      "avoid": [
        "detail",
        "additional elements",
        "gradients",
        "any visible text",
        "reflection highlights"
      ],
      "reads_at_250px_via": "the red disc against cream - engineered for the thumbnail grid",
      "render_prompt": "extreme minimalist poster, three colours only, one large flat red circle, pure black torii silhouette on a still water horizon, vast negative space, zen composition, no gradients, palette Red Moon strictly limited to #0D0D0D #F5F1E8 #C1272D"
    },
    "production": {
      "target_platforms": [
        "displate"
      ],
      "aspect_ratio": "1:1.4",
      "px": [
        4000,
        5600
      ],
      "dpi": 300,
      "colour_mode": "sRGB",
      "format": "PNG",
      "background": "opaque",
      "edge_buffer_px": 220
    },
    "metadata": {
      "displate": {
        "title": "Red Moon Over the Water Gate",
        "tags": [
          "minimalist japanese",
          "torii gate",
          "red and black",
          "zen composition",
          "high contrast minimal",
          "japandi decor"
        ],
        "description": "Three colours, one horizon, and a great deal of quiet. A torii reduced to its silhouette under a single flat disc of red, built so it still reads from the far side of the room.",
        "collection": "Quiet Japan"
      }
    },
    "ip": {
      "tier": "R0"
    },
    "dedup": {
      "hard_key": "ps_minimal_zen|pal_red_moon|torii"
    }
  },
  {
    "concept_id": "tee_flytying_chart_01",
    "product_class": "tshirt",
    "batch_role": "evergreen",
    "demand": {
      "query": "fly tying shirt",
      "cluster": "flyfishing_flytying",
      "adjacent": [
        "fly tying gift for him",
        "streamer pattern tee",
        "trout bum shirt",
        "fly fisherman christmas gift",
        "winter steelhead shirt",
        "vise and hackle shirt",
        "fly tying bench decor",
        "euro nymphing shirt",
        "fly angler apparel",
        "dry fly pattern chart"
      ],
      "evidence": "marketplace_autocomplete",
      "evidence_note": "Autocomplete depth on Amazon and Etsy; long-tail ecosystem across the adjacent set",
      "est_monthly_volume": 1400,
      "competition": "low",
      "competing_results_est": 900,
      "niche_id": "nb_hobby"
    },
    "angle": {
      "audience": "anglers who tie their own flies at a home bench through the winter and can name a hackle by feel",
      "insider_vocab": [
        "dubbing",
        "hackle",